{
  "request_id": "8fe31aa0-89f0-46ca-91bf-46352ebbe13d",
  "trace_id": "fed28e72-3d01-476d-b682-e7f90febd9cf",
  "topic": "empanada machine",
  "locale": "en-US",
  "location": "United States",
  "site_url": "https://maquiempanadas.com",
  "seed_keywords": ["empanada machine", "industrial empanada machine"],
  "target_audience": "US food manufacturers and commercial kitchens buying forming equipment",
  "conversion_goal": "request a quote",
  "limits": {
    "max_keywords": 30,
    "max_serp_queries": 5,
    "max_competitor_pages": 0,
    "max_gsc_rows": 25000,
    "max_site_urls": 10000,
    "provider_budget_usd": 0.25
  }
}
